{
  "schemaVersion": "4.0.0",
  "recordType": "role_classification",
  "recordId": "mg-role-example",
  "createdAt": "2026-07-24T00:00:00Z",
  "status": "PUBLISH_WITH_WARNINGS",
  "provenance": {
    "disclaimer": "Bu değerler yalnızca mimari örnektir; güncel veya doğrulanmış Mason Greenwood verisi değildir."
  },
  "canonicalPlayerId": "player-mason-greenwood-example",
  "positionScope": "RW",
  "roleCandidates": [
    {
      "roleId": "inside_forward",
      "confidence": 0.91
    },
    {
      "roleId": "wide_creator",
      "confidence": 0.62
    }
  ],
  "primaryRole": {
    "roleId": "inside_forward",
    "archetype": "scoring_inside_forward"
  },
  "secondaryRoles": [
    {
      "position": "CF",
      "roleId": "channel_forward",
      "confidence": 0.78
    },
    {
      "position": "LW",
      "roleId": "creative_inside_forward",
      "confidence": 0.72
    }
  ],
  "archetypes": [
    "scoring_inside_forward"
  ],
  "evidenceMetricIds": [
    "role_minutes_share",
    "npxg_per90"
  ],
  "contradictingEvidenceMetricIds": [],
  "sampleMinutes": 3100,
  "confidence": 0.91
}
